{
  "$schema": "coverage-schema-v1.json",
  "schema_version": 1,
  "corpus_version": "1.0.0",
  "upstream": {
    "distribution": "rHEALPixDGGS",
    "version": "0.6.0",
    "source_url": "https://github.com/manaakiwhenua/rhealpixdggs-py"
  },
  "contract": {
    "polygon_selection": "strict ellipsoidal centroid containment",
    "line_interpretation": "straight segments in coordinate space",
    "known_upstream_limits_corrected_outside_corpus": [
      "antimeridian-crossing lines and polygons",
      "lines crossing polar cap cells"
    ]
  },
  "counts": {
    "point_edges": 3,
    "regions": 4,
    "lines": 5,
    "polygons": 4
  },
  "point_edges": [
    {
      "longitude": 10.0,
      "latitude": -20.0,
      "resolution": 3,
      "cell": "Q616"
    },
    {
      "longitude": 10.0,
      "latitude": 20.0,
      "resolution": 3,
      "cell": "Q070"
    },
    {
      "longitude": 20.0,
      "latitude": 10.0,
      "resolution": 3,
      "cell": "Q320"
    }
  ],
  "regions": [
    {
      "id": "northern_quad",
      "configuration": [
        0,
        0
      ],
      "resolution": 1,
      "upper_left": [
        0.0,
        60.0
      ],
      "lower_right": [
        90.0,
        0.0
      ],
      "plane": false,
      "cells": [
        [
          "N2",
          "N1",
          "N0"
        ],
        [
          "Q0",
          "Q1",
          "Q2",
          "R0"
        ],
        [
          "Q3",
          "Q4",
          "Q5",
          "R3"
        ]
      ]
    },
    {
      "id": "southern_lune",
      "configuration": [
        0,
        0
      ],
      "resolution": 1,
      "upper_left": [
        0.0,
        -30.0
      ],
      "lower_right": [
        90.0,
        -90.0
      ],
      "plane": false,
      "cells": [
        [
          "Q6",
          "Q7",
          "Q8",
          "R6"
        ],
        [
          "S8",
          "S7",
          "S6"
        ],
        [
          "S4"
        ]
      ]
    },
    {
      "id": "southern_cap",
      "configuration": [
        0,
        0
      ],
      "resolution": 1,
      "upper_left": [
        -180.0,
        -36.0
      ],
      "lower_right": [
        -180.0,
        -90.0
      ],
      "plane": false,
      "cells": [
        [
          "O6",
          "O7",
          "O8",
          "P6",
          "P7",
          "P8",
          "Q6",
          "Q7",
          "Q8",
          "R6",
          "R7",
          "R8"
        ],
        [
          "S0",
          "S1",
          "S2",
          "S5",
          "S8",
          "S7",
          "S6",
          "S3"
        ],
        [
          "S4"
        ]
      ]
    },
    {
      "id": "custom_polar_layout",
      "configuration": [
        1,
        3
      ],
      "resolution": 1,
      "upper_left": [
        0.0,
        60.0
      ],
      "lower_right": [
        90.0,
        0.0
      ],
      "plane": false,
      "cells": [
        [
          "N8",
          "N5",
          "N2"
        ],
        [
          "Q0",
          "Q1",
          "Q2",
          "R0"
        ],
        [
          "Q3",
          "Q4",
          "Q5",
          "R3"
        ]
      ]
    }
  ],
  "lines": [
    {
      "id": "upstream_polar_doctest",
      "configuration": [
        0,
        0
      ],
      "resolution": 3,
      "start": [
        -89.669615,
        86.549596
      ],
      "end": [
        -134.0,
        86.0
      ],
      "plane": false,
      "cells": [
        "N448",
        "N447"
      ]
    },
    {
      "id": "upstream_wrapper_doctest",
      "configuration": [
        0,
        0
      ],
      "resolution": 9,
      "start": [
        -176.260506,
        -43.738058
      ],
      "end": [
        -176.258807,
        -43.738379
      ],
      "plane": false,
      "cells": [
        "S001450634",
        "S001450635"
      ]
    },
    {
      "id": "equatorial_diagonal",
      "configuration": [
        0,
        0
      ],
      "resolution": 3,
      "start": [
        0.0,
        0.0
      ],
      "end": [
        40.0,
        20.0
      ],
      "plane": false,
      "cells": [
        "Q333",
        "Q330",
        "Q331",
        "Q332",
        "Q308",
        "Q316",
        "Q317",
        "Q314",
        "Q315",
        "Q312",
        "Q320",
        "Q321",
        "Q087",
        "Q088",
        "Q166",
        "Q163",
        "Q164",
        "Q165",
        "Q162",
        "Q170"
      ]
    },
    {
      "id": "cell_edge_start",
      "configuration": [
        0,
        0
      ],
      "resolution": 3,
      "start": [
        10.0,
        -20.0
      ],
      "end": [
        80.0,
        40.0
      ],
      "plane": false,
      "cells": [
        "Q616",
        "Q613",
        "Q614",
        "Q611",
        "Q612",
        "Q378",
        "Q386",
        "Q383",
        "Q384",
        "Q381",
        "Q382",
        "Q358",
        "Q436",
        "Q433",
        "Q434",
        "Q431",
        "Q432",
        "Q408",
        "Q416",
        "Q413",
        "Q414",
        "Q411",
        "Q412",
        "Q178",
        "Q186",
        "Q183",
        "Q184",
        "Q181",
        "Q182",
        "Q158",
        "Q236",
        "Q233",
        "Q234",
        "Q231",
        "Q232",
        "Q208",
        "Q216",
        "Q217",
        "Q214",
        "Q215",
        "Q212",
        "Q220"
      ]
    },
    {
      "id": "custom_polar_layout",
      "configuration": [
        1,
        3
      ],
      "resolution": 3,
      "start": [
        -89.669615,
        86.549596
      ],
      "end": [
        -134.0,
        86.0
      ],
      "plane": false,
      "cells": [
        "N446",
        "N443"
      ]
    }
  ],
  "polygons": [
    {
      "id": "unit_square_r4",
      "resolution": 4,
      "exterior": [
        [
          0.0,
          0.0
        ],
        [
          0.0,
          1.0
        ],
        [
          1.0,
          1.0
        ],
        [
          1.0,
          0.0
        ]
      ],
      "holes": [],
      "cells": [
        "Q3330"
      ]
    },
    {
      "id": "unit_square_r5",
      "resolution": 5,
      "exterior": [
        [
          0.0,
          0.0
        ],
        [
          0.0,
          1.0
        ],
        [
          1.0,
          1.0
        ],
        [
          1.0,
          0.0
        ]
      ],
      "holes": [],
      "cells": [
        "Q33303",
        "Q33304",
        "Q33305",
        "Q33306",
        "Q33307",
        "Q33308",
        "Q33330",
        "Q33331",
        "Q33332"
      ]
    },
    {
      "id": "unit_square_r6",
      "resolution": 6,
      "exterior": [
        [
          0.0,
          0.0
        ],
        [
          0.0,
          1.0
        ],
        [
          1.0,
          1.0
        ],
        [
          1.0,
          0.0
        ]
      ],
      "holes": [],
      "cells": [
        "Q333033",
        "Q333034",
        "Q333035",
        "Q333036",
        "Q333037",
        "Q333038",
        "Q333043",
        "Q333044",
        "Q333045",
        "Q333046",
        "Q333047",
        "Q333048",
        "Q333053",
        "Q333054",
        "Q333056",
        "Q333057",
        "Q333060",
        "Q333061",
        "Q333062",
        "Q333063",
        "Q333064",
        "Q333065",
        "Q333066",
        "Q333067",
        "Q333068",
        "Q333070",
        "Q333071",
        "Q333072",
        "Q333073",
        "Q333074",
        "Q333075",
        "Q333076",
        "Q333077",
        "Q333078",
        "Q333080",
        "Q333081",
        "Q333083",
        "Q333084",
        "Q333086",
        "Q333087",
        "Q333300",
        "Q333301",
        "Q333302",
        "Q333303",
        "Q333304",
        "Q333305",
        "Q333306",
        "Q333307",
        "Q333308",
        "Q333310",
        "Q333311",
        "Q333312",
        "Q333313",
        "Q333314",
        "Q333315",
        "Q333316",
        "Q333317",
        "Q333318",
        "Q333320",
        "Q333321",
        "Q333323",
        "Q333324",
        "Q333326",
        "Q333327",
        "Q333330",
        "Q333331",
        "Q333332",
        "Q333333",
        "Q333334",
        "Q333335",
        "Q333340",
        "Q333341",
        "Q333342",
        "Q333343",
        "Q333344",
        "Q333345",
        "Q333350",
        "Q333351",
        "Q333353",
        "Q333354"
      ]
    },
    {
      "id": "unit_square_with_hole",
      "resolution": 6,
      "exterior": [
        [
          0.0,
          0.0
        ],
        [
          0.0,
          1.0
        ],
        [
          1.0,
          1.0
        ],
        [
          1.0,
          0.0
        ]
      ],
      "holes": [
        [
          [
            0.3,
            0.3
          ],
          [
            0.3,
            0.7
          ],
          [
            0.7,
            0.7
          ],
          [
            0.7,
            0.3
          ]
        ]
      ],
      "cells": [
        "Q333033",
        "Q333034",
        "Q333035",
        "Q333036",
        "Q333037",
        "Q333038",
        "Q333043",
        "Q333044",
        "Q333045",
        "Q333046",
        "Q333047",
        "Q333048",
        "Q333053",
        "Q333054",
        "Q333056",
        "Q333057",
        "Q333060",
        "Q333061",
        "Q333062",
        "Q333063",
        "Q333064",
        "Q333066",
        "Q333067",
        "Q333070",
        "Q333071",
        "Q333072",
        "Q333080",
        "Q333081",
        "Q333083",
        "Q333084",
        "Q333086",
        "Q333087",
        "Q333300",
        "Q333301",
        "Q333303",
        "Q333304",
        "Q333306",
        "Q333307",
        "Q333308",
        "Q333316",
        "Q333317",
        "Q333318",
        "Q333320",
        "Q333321",
        "Q333323",
        "Q333324",
        "Q333326",
        "Q333327",
        "Q333330",